US	30196122	R2IEV1YCX6DKXU	0974897833	428097829	Drugproof Kids: The Ultimate Prevention Handbook for Parents to Protect Children from Addictions	Books	4	0	0	false	false	Dr Spock for the drug generation	Frank Simonelli has written the parent's handbook for preventing their kids from falling into the dark world of drugs.  This is a book every parent should have and read.<br />Mr. Simonelli approaches the problem of drug abuse from the whole family approach.  Stressing self-esteem and a positive approach to head off problems rather then a \\"scolding\\" too late reaction to a child's experimenting with drugs.	2004-06-21
US	35537618	R3RQR1F1MVHJD3	0689846924	896276793	Mommy, What If...?	Books	5	0	0	false	false	WOW	My son is now 18mos old.  He got this book when he was about 6mos old - we read to him almost every night.  This is by far his favorite.  He loves the pop-ups.  I've actually had to buy another copy, the pop-ups haven't held up very well.....but the story itself is wonderful.  It teaches a great lesson - and it's done in a way to keep a toddler interested.	2004-06-21
US	20451441	R2QZBUWW6BF07T	0744000416	116230003	Final Fantasy IX Official Strategy Guide (Video Game Books)	Books	5	0	27	false	false	Useful Guide	Most people here are complaining about the &amp;amp;quot;advertisements&amp;amp;quot; in the guide. Wrong! They aren't advertisements - the web site featured is actually beneficial to your gaming. When you have a internet-capable computer it is very easy to access this webpage and find quick secrets in the game. The online feature is for people who don't mind taking 2 minutes to log on AND register at the site.	2004-06-21
US	17587917	RJ0O01VBOKD2S	1555973949	331479528	New British Poetry	Books	5	17	18	false	false	BRILLIANT	I'm giving this brilliant anthology five stars, despite its infuriating introduction. The UK poetry scene is smaller than its US counterpart, so the &quot;poetry wars&quot; there must be like a knife fight in a phone booth. I can't understand why co-editor Don Paterson wants to fuel the conflict, as he himself admits that there are some &quot;attractive voices&quot; among the Post-modern camp. Wouldn't it have been more representative to include some of these, rather than the pedestrian Jacky Kay or the dull Andrew Motion?<br />However, the vast majority of the poets in this collection are anything but dull and pedestrian. There's an edgy postmodernity driving the work of John Ash, W.N. Herbert, Peter Didsbury and Jo Shapcott, for instance, and the more formal poets, like Peter Reading and Alice Oswald, are stunning technicians. There's surprisingly little of the &quot;blokey&quot; anti-intellectualism of Larkin and his heirs, though Larkin's masterfully elegiac tone and engagement with the colloquial are detectable in the work of Carol Ann Duffy and Sean O'Brien. I should add that Paterson's own poems are included. After grinding my teeth over his bad tempered factionalism I didn't want to like his poetry, but I found it stunning. <br />This book is required reading for American poetry readers as well as an exciting resource of imaginative possibilities for American poets. Just razor out a few pages of the introduction and stick in a few poems by Denise Riley.	2004-06-21
US	17574953	RAKOODQ3WJKRX	0452276594	143269121	Natural Childbirth the Bradley Way: Revised Edition	Books	5	3	7	false	false	Helpfull hints	This book was a wonderful tool in my child birthing experience.  I recommend that all expecting mothers read this book for the best experience in child birthing.<br />Thank you Susan for a great book!	2004-06-21
US	36429809	R21QAHH7M9NBEV	0679642811	448968193	The Crisis of Islam: Holy War and Unholy Terror	Books	4	2	9	false	false	Difference in perceptions cause today's world problems	In the Crisis of Islam, Bernard Crick takes a detailed look into the history of the Muslim world and its perceptions of the West.  He attributes most of the conflicts between the Western and modern worlds to differences in views on religion, politics, and social life.  For example, Muslims believe that Muhammad was God's Prophet, who came to bring his final revelations.  Also, they do not recognize Jesus, or any other person, as the Son of God.  Therefore, this causes them to see Christians as \\"infidels,\\" who are ruining the word of God, and vice versa.  Another aspect that Crick points out is the role of religion in government and tolerance of religion.  Many Muslims in the Arabic world see the West as corrupting practicing believers causing them to leave their faith.  In their eyes, the tempter, who causes one to lose belief in Islam, is a greater threat than the Christian or the Jew.  The view of the United States, who brings a liberal culture full of sex, drugs, and rock n' roll, leads certain fundamentalist groups to view it as ruining the Islamic mission of spreading the word to the people of the world.   This causes the backlash that is present in today's terrorism.<br />Crick goes in depth on many of these points.  He also gives a brief summary of the history of the region, and Western actions there.  It is a good read to attempt to understand some of the causes of today's conflicts with terrorism. A word of advice though, it is a difficult read as Crick shows the vocabulary that comes from an Ivy League education.	2004-06-21
US	35703955	R3M3VC674HHAYW	0674013751	993113437	American Empire: The Realities and Consequences of U.S. Diplomacy	Books	2	18	26	false	false	Seems over long at <300 pages.	Writing in the Summer 2002 issue of Parameters Andrew J. Bacevich observed in a book review \\"This is a book on considerable wisdom, larded with considerable nonsense. \\"  The same criticism could be lodged against American Empire.<BR>  This book is part of a group of volumes in recent years, like Chalmers Johnson's Blowback and Samuel Huntington's Clash of Civilizations and the Remaking of World Order which suggest that we should reevaluate the history of American foreign policy, pushing aside idealistic self-delusion and recognizing that a continuing driving need to open new markets abroad and forcing the international community to conform to policies of economic liberalism which make the world safe for American business interests.  What differentiates this crop of criticism from that which came before is that is comes not from the traditional academic left, but from former cold-warriors and thinkers more closely associated with the political right.<BR>Bacevich starts by reviewing the careers and theories of two diplomatic historians, Charles Beard and William Appleman Williams.  Both theorists viewed U.S. foreign policy through an economic lens, tracing the source of American actions abroad to conditions at home.  The both are in line with Bacevich in attacking the view of the United States as a \\"reluctant superpower.\\"  On Page 24 he quotes Beard \\"Empires are not built in fits of absent mindedness.\\"  The author acknowledge that both these individuals were largely discredited late in their carreers for failing to see the hostile ideology of the day as any kind of threat.  Beard dismissed the rise of European Fascism, while Williams similarly ignored international communism.  This is ironic for while Bacevich, with the advantage of hindsight, acknowledges Nazi and Stalinist/Maoist regimes as legitimate threat worthy of U.S. military intervention, he seems dismissive of the rising threat of violent religious fundamentalism.<BR>After this section comes the highpoint ofthe book, an intriguing if slanted history of U.S. foreign policy of the post Cold War era.  Working primarily from news reports, speeches and public documents, the author compiles an intriguing analysis of the events of the two Bush and Clinton administrations.  While focusing on the last 14 years, he also tries to connect the actions to long-term trends in U.S. diplomacy dating back to at least the Spanish American War.  Unfortunately this ambitious work of historical analysis is underplayed in favor of a survey of more recent events.<BR>  The usefulness of this portion as a reference is compromised by the fact that the events described are not ranged chronologically, but rather the author seems to be trying to group the material by theme in chapters titled \\"Globization and its Conceits\\" and \\"Policy by Default\\" among others.  These themes are so repetitive however that that it is hard to pick out just what point a particular incident is supposed to evidence. <BR>  After this comes a series of out of place digressions on a variety of topics.  Other readers have noted that the book at time reads more like a selection of separate essays tenuously connect rather than a unitary, flowing argument.<BR> The chapter \\"Gunboats and Gurkas\\" discussing the reluctance of the U.S. to commit forces and its tendency to fight conflict either by proxy or through high-technology.  This is followed directly by \\"Rise of the Proconsuls\\" which suggest that we as citizens should be wary of the foreign policy power invested in American military elites.  \\"Proconsuls\\" is interesting in that a large portion of the chapter is devoted to GEN Wesley Clark's behavior in the NATO-Serbian war, with the material derived predominantly from Clark's own book.  Despite the source,  the text does not display the General in a positive light.<BR>  With the bulk of it appearing to have been written prior to the tragedy of September 11, 2001, the observations in this book about the Bush administration's foreign policy in regards to the Mid-east have not aged well.  The Author makes reference to the war in Afghanistan; however he seems to feel that the events of that conflict did not signal a fundamental change in US foreign policy practice, or the alleged reluctance of America to commitment ground forces.  The current occupation of Iraq makes some of his statement almost comical.  For example:  He suggests you can rate the administration commitment to the current conflict by the number of reserve component soldiers called up, stating \\"The president ordered modest numbers of national guardsmen to active duty-far less than in 1990-but most citizen-soldiers called to the colors were assigned duties no more hazardous than providing backup security inside airport terminals.\\"  With tens of thousands of Nation Guardsmen currently deployed around the world and 88 dead in Operation Iraqi Freedom alone, this line seems both flippant and naive.   \\"(The Bush Team) made no preparations to take the fight to the Taliban...U.S. forces in (as opposed to above) Afghanistan was confined to a single raid by about a hundred Army Rangers, as inconsequential as it was brief.\\"  In light of subsequent events, one can only conclude that Dr. Bacevich severely misread the intentions of the Bush administration.<BR>Interestingly, the sentence above is included verbatim in a National Review article Mr. Bacevich wrote nearly a year earlier.    That piece made most of the same points as the \\"War for Imperium\\" chapter, in about the same number of pages. This would seem to lend credence to the theory that this piece was assembled out of previously existing essays or at least that he was mining the his existing works for material to flesh out the book.<BR>  Despite the merits of offering a diplomatic history of the post cold war era, American Empire as a whole is a largely unsatisfying work.  The author's core thesis, while not irrefutable, is one worthy of further research and discussion, Overall, Bacevich offers a good attempt at contemporary diplomatic history and analysis and then sabotages it with a dearth of unnecessary and off topic material.	2004-06-21
US	51109383	R1B2ZTD9VB294I	1582617678	120411108	Red Sox vs. Yankees: The Great Rivalry	Books	5	2	3	false	false	Greatest purchase you'll ever make	There are books, and then there are books by Harvey and Fred Frommer.<BR>  <BR>Sure lots of people can tell you where they were when Clinton was not having sexual relations with that woman or Janet Jackson had her wardrobe malfunction or whatever--true Red Sox and Yankee fans can tell you where they were when they purchased this masterpiece by Harvey and Fred \\"effing\\" Frommer.  This father-son team whips up a frothy marketing frenzy rife with on-line reviews full of hyperbolic praise which would seem out of line if it were not backed up by the masterful work of Harvey and his other-worldly talented offspring, Frederic J. Frommer.  While Harvey may claim this to be a coffee table book, he's not fooling anyone--I haven't put mine down yet, on the coffee table or anywhere else for that matter.<br />The incredible archival work by the Frommers brings the history of this classic rivalry alive in a way that will allow you to discuss with your children the similarities to the Peloponnesian war, and more importantly, the Frommers as modern day Thucydudeses.<br />I particularly enjoyed the photos from the much sought after private collection of Harvey, as well as those blatantly new fangled, cutting edge of technology \\"digital photographs\\".<br />At a mere $24.95, this has to be the literary bargain of the decade.  Any baseball fan should pick up at least two copies per fan to prevent any shortcomings on the bottom line for Sports Publishing Inc..	2004-06-21
US	52995728	R3W1FI9JP4XMSU	0851514855	202863367	The Religious Affections	Books	5	23	24	false	false	May be the most important book ever written in America	I am amazed how often the great work by America's greatest thinker has insight and application to modern church ministry.  As a pastor, this work ranks among the top works I have read in understanding the gospel, the work of the Holy Spirit, the nature of genuine salvation.  There are three major parts to this work.  The first section Edwards defines what a religious affection is and how it is different from what he calls animal affections.  This distinction is both necessary for understanding his work, but also is a helplful tonic for insight into today's religious movments and modern worship experiences.  In the second section, Edwards develop 12 marks that do not argue for or against the work of the Spirit.  The Great Awakening had many excesses and abuses which Edwards neither support the event nor do they necessarilly take away from it.  What is interesting about this section is that Edwards is saying that these marks ultimately mean nothing.  Yet, most of what is found here is the basis of much of today's evangelical church.  In my first reading I kept finding myself saying but this is what I was taught to be Biblical Christianity.  Edwards was saying if you have this experience or don't have this experience means is not proof one way or the other about your conversion.  In the third section Edwards develops the 12 marks that are truly evidences of the working of the Holy Spirit.  This section is extremly helpful for the modern minister.  With great care and lengthy development of thought, Edwards walks you through the marks of genuine conversion.<br />Edwards is hard to read for those who are just getting started with him.  However, the more you read the easier he becomes.  Don't give up too soon - you will get back 10 fold for all the effort you put in.  The particular edition you are reading about is easy on the pocket book.  If you have limited funds, it is a good way to get started.  However, if you are serious about reading Edwards, don't forget to checkout the Yale editions.  They are very expensive, but the foot notes, extensive introductions, and indexs are worth the extra money.	2004-06-21
US	52791632	R8YRPN1JFELHZ	0352332778	100588467	The Name Of The An Angel (Black Lace)	Books	3	9	9	false	false	Great premise ... bad execution  .....	Clarissa Cornwall, a 30'ish something lecturer of erotic lit (ain't that cute) finds herself in a quandry when one of her new students, the hunky young Nick, shows up in class and from day one, hidden from view of the rest of the lecture hall shows Clarissa that he's got other things in his mind and hands. <br />The foolishness of this book and what I foud disappointing was that even though the author spent time developing Clarissa as the frustrated and ethically torn lecturer having the hots for this student, only to find that when shes alone with Nick for no less than about a minute and a half shes got no scruples or ethical problems. For this review ... trust me little Clarissa's no wall flower. <br />Even worse ... maybe half an hour after her first meet with Nick shes bent over the 'bonnet' of her car on the main thoroughfare of the university town doing what even would make the most debased stripper flinch .... maybe not flinch but you get the message .....<br />Although the sex scenes are very very hot they are only that a series of viginette sex scenes ... what the book lacks is any kind of pursuit .. capture ... and ultimate sweet submission which is what I believe all great erotic lit should contain .....	2004-06-21
US	52801590	R2JL54P1VDA0H5	078144165X	840969768	Cracking Da Vinci's Code: You've Read the Fiction, Now Read the Facts	Books	1	23	34	false	false	Authors offering no unbiased 'facts' nor research	These scholarly authors calm to be offering \\"facts\\" in their book and \\"cracking the code\\" but they did no more than poorly write a book with very little fact nor research.<br />They had this very lame intro to every chapter with this character names Carrie who gets involved in a cult worshiping 'Brown beliefs'.  This was dumb and they sounded like some very out of date 70 year olds TRYING to appeal to younger audiences but deparately failing.  They sounded more like very conservative religous scholars who have become paranoid over the success of a novel . . fictous novel by the way . . . <br />The authors were trying to claim that Da Vinci code is going to lead to drugs and sex, and Brown has hidden intentions of his book leading to a cult . . at least that is what I kept picking up.  And leading good Christians astray from their beliefs.  Well, if a Christian walks away from his/her beliefs from a fictionary novel, then they were not very strong Christians in the first place.<br />This book was so poorly written, I kept finding myself laughing out loud in parts and being completely puzzled as to the points the authors were trying to make.  It almost made it a good read because it was so off the mark!<br />I thought Da Vinci Code was a great novel and would have loved to have read a book objectively addressing some religous issues used in the storyline.  This book is neither!  It doesn't well agrue any bibical agruement, but rather makes a rather open statement then moves on.  I felt there was no research at all going into this Cracking the Da Vinci code.  How two 'scholars' could put a book out there with such lame research and a dumb Carrie storyline is beyond me! <br />Don't waste your time or money on this one.  If you want an objective book, look through some of the others that are popping up and read those reviews.  Hopefully someone will have a good one to offer the curious mind!	2004-06-21
US	52010089	R3CU8W2BDGEDLG	0671025368	758176148	The Coldest Winter Ever	Books	5	1	1	false	false	A teacher's lesson	I'm a teacher and I kept watching my 8th graders walking around with this book.  I figured that it had to be all about sex for it to grab their attention.<br />However, I was shocked.  This novel had little to do about sex and it was an eye-opener about the real world.  Few of us live in this world that Sister Soulhah described so vividly.  We rarely see or read about all the effects of drugs that Souljah includes in her novel.  I invite everyone to read it.  It was worth my money and my time.  Trust me, you will not want to put it down even when you're finished reading it.	2004-06-21
US	38685100	R1QH9UF75IFYZQ	0399151001	287711100	Maverick Mind	Books	5	15	18	false	false	AMAZING BOOK, AMAZING FAMILY	Our family has been lucky enough to meet Dr. Florance and her 3 children after reading her book.  It not only gave faces to the names, but it was a joy to see how wonderful they are as a family.  Dr. Florance's book has helped our family understand another way of looking at how our brain functions. This book is not a tutorial, however it is a window for some autistics who you know can understand everything that is said to them and can communicate in their minds, just not through their voice. My husband is a neurosurgeon who has a lifetime of not understanding how his brain worked \\"differently\\" from others, our 5 year old is gifted and absolutely a visual learner, and our 4 year old son has been diagnosed with autism and PDD since he was 2 years old. After months of different therapy that seemed to just to be going through the motions, one of our therapist brought us this book and it was like turning a light bulb on. Our son, so much like Florance's, can run a computer, a dvd player, and appears to understand everything said to him, yet cannot form correct speech. This book is for those who want to learn how their child's brain is working and then how to possibly find ways to \\"re-wire\\" or concentrate on areas to eventually bring those \\"pictures\\" to words. I would highly recommend this book for those who enjoy a heart-warming story of a mother's \\"gut instinct\\" and determination; and also for those who are looking at another way to understand how some highly visual learners and some autistics are \\"wired\\" differently.	2004-06-21
US	47319416	R2A1MK8D92XUKV	0738847194	44836535	Blood of the Goddess	Books	5	1	2	false	true	Fantastic Book!	This book is amazing.  The author has integrated spiritual teaching in the form of fiction.  The story is deep and mysterious.  It is mystical.  The characters are real.  This book delves into the mysteries of Kaula Tantra in Hinduism in a way that the reader can understand.	2004-06-21
US	38753134	R3G11QCA3Y3C8O	0679600116	705442339	Ulysses (Modern Library 100 Best Novels)	Books	1	20	52	false	false	Pretentious intellectual self-absorption	I was tempted to write this review after reading the other reviews.  It seems that most readers had to struggle through it or use Cliff Notes.  In short, it seems many succumbed to the peer pressure that it was a \\"great\\" book and that they just \\"had\\" to read it.  It puts me in mind of someone going to an art gallery full of atrocious modern art and faking that they liked it to show how sophisticated they are.  The truth is this book stinks.<br />For one thing it is vulgar, which, I hate to disappoint anyone, requires no talent at all.  This is a talent any six year-old boy possesses.  Is the wordplay clever?  Yes, too clever.  James Joyce must have been incredibly pleased with himself. <br />(...)himself.	2004-06-21
US	52598686	R1HZ1GGWC33UM2	0553382195	866877384	Villa Incognito	Books	2	0	1	false	false	lite Robbin's snack till his next Big Thing	Not Tom's best by a long shot (I've read'm all), though I liked it better than Fierce Invalids.  This is due more to a prurient self-interest in Japanese mythology, South East Asia, hot Asian women, sex and sake than it is to anything like character and plot.  The novel doesn't end, but rather poops out.  As a platform for Tom's philosophical whimsy, it offers little he hasn't already said, though I agree with him whole-heartedly.  If you're already a fan, read it for Tom's characteristic bubbling prose.  Newcomers should start with Skinny Legs, Jitterbug, or Still Life and go from there. Frankly, Tom lost his edge with Frog Pajamas and has been sliding down the slippery slope ever since.	2004-06-21
US	41467768	RKK5WP7UJ5WO8	0451191145	604964480	Atlas Shrugged	Books	3	6	13	false	false	Some of the good, some of the bad...	Ayn Rand was a woman who, at her best, believed fiercely in the near supernatural worth of the human animal. I cannot and will not argue with her on this idea, as I do not completely disagree with her. However, my comment on this novel revolves around her attempt in this novel to describe the various elements extant in the world which she believes work to destroy this near-godly spirit embedded in the persona of modern man.<br />&quot;Atlas&quot; is not a work for the fence sitter. Reading it will make all but the most stubborn minds take one opinion or the other about her viewpoint. This polarizing effect makes many people hate the book, and it made me want to hurl it at the wall several times. Frequently, I found her view, which describes the Objectivist philosophy, destructive and unrealistic. To be honest, when you consider man to be a demi-god whose purpose in life to destroy the elements of life that try to crush him, it is nearly impossible to write a book that is either realistic or that will appeal to all who read it.<br />At best, Objectivism scores its best points in its economic statements. The way it is presented, it certainly makes sense that the primary goal of industry should be to make money, and the public good be damned. For what other purpose should industry exist than for the building of wealth? From the viewpoint of this novel and from other sources on Objectivism, it makes as much sense to suggest that businesses look out for the public good as it does to insist that charitable organizations should exist to make money.<br />In the end, I do not agree with Objectivist philosophy, but that does not mean I do not admire this book. To be sure, this story is pure fantasy, and those that would endeavor to follow its example are, in my opinion, foolhardy, but this novel exists as an exhilarating work. Sure, the characterizations are wooden and one-dimensional, but I dare anyone to read Rand's elegant prose and resist getting swept up in it at least once or twice.	2004-06-21
