US	52844056	R3TW8QCY2FBI4F	0486410870	171901743	Magic and Showmanship: A Handbook for Conjurers (Dover Magic Books)	Books	5	21	22	false	false	Review by a Professional Magician of a Very Important Book	I have been a professional magician for the better part of 32 years. When I first started into magic full time, this was one of the books that I read and re-read thoroughly. It gave me real insight into how to create a consistent character and how to THINK about magic when I was doing magic.<br />I fully believe that most people who have purchased this book have never read it. If they had, there would be more really excellent magicians in the world. But you can tell the ones who have read it and who understand it, because their magic is consistent, convincing and natural.<br />If you want to do good magic, buy this book and read it. It will tell you how to think, speak and act when you are performing. And it will give you some material that is not too difficult, but has very great impact upon an audience. And don't worry about performing that material in front of someone else who has purchased this book. He probably hasn't read it anyway! If he has, he won't tell the secrets!<br />Bill Palmer, MIMC<BR>Merlin the Magician of the Texas Renaissance Festival	2004-06-21
US	17594206	R2RS0MZZV1EHBZ	0764221027	533861643	Mary-Another Redeemer?	Books	1	10	22	false	false	What I found most amusing...	What I found most amusing was the criticism of the non-existent Pope Sixtus VI. As someone demonstrated below, this can't be dismissed as a typographic error. But that's a small Roman tomato compared to White's ridiculous comments about the early Christian views of Mary. White cannot be compared at all favorably to non-Catholic scholars such as Jaroslav Pelikan (Lutheran turned Orthodox) or the late J.N.D. Kelly (Anglican). <br />Better to read:<br />Luigi Gambero's &quot;Mary and the Fathers of the Early Church;&quot; <BR>John Henry Newman's &quot;Mary: the Second Eve;&quot; <BR>Ignace de la Potterie's &quot;Mary in the Mystery of the Covenant;&quot; or<BR>Rene Laurentin's &quot;A Short Treatise on the Virgin Mary.&quot;	2004-06-21
US	17591712	R3RAT9RCH56OOL	0875793266	520519634	Jesus the Christ	Books	5	17	24	false	false	It Will Blow You Away	This is my favorite books yet. I remember my wife brought this nice hardcover book home for display for our table in the living room to add to the home. I flipped through a couple of pages and promised myself I would read 1 chapter a day. So I figured 42 chapters will be 1 month and a half. I was literally hooked I finished it in 1 month. Now I'm reading it again! This book quadrupled my testimony of the Church and why Jesus came to restore His church. And why the gathering of the &quot;Lost House of Israel&quot; is so important. If you love this book read Articles of Faith also. I have learned since becoming a Latter-day Saint there are 2 set of Christians. (1) Those who wait for the second coming. (2)Latter-day Saints who prepare for the second coming!	2004-06-21
US	17592371	R1AETOFD2O3RFS	0929445074	100784399	Man Ray : Paris Photographs, 1920-34	Books	4	6	6	false	false	A Photographer  to Think About	Man Ray left his mark on photography not only as a photographer but as an innovator.  In the book Man Ray: Paris Photographs 1920-34 he pushed the formal boundaries to create his own imaginative style.  The photos as well as the layout of book have been carefully executed through his knowledge of design.<BR> <BR> This book features objects, nudes, portraits and Rayographs.  The space between truth and fiction is bridged through the elements of design and his images are visually pleasing.  His nudes define femininity. They are ideal for the male gaze which captures the essence of the female form through erotic eyes.  It is evident that Man Ray knew the rules therefore he could break them.  Rayographs were made by placing objects directly on film.  Ray created graphically interesting images using this process which contained both dada and surrealist ideas.	2004-06-21
US	51280836	R38NWGAWUJBS7I	1583331417	29874233	Stop The Clock! Cooking:  Defy Aging--Eat The Foods You Love	Books	5	28	29	false	false	My New Way of Life	I am a fitness professional, and last May I attended a lecture at UCLA on anti-aging foods taught by the author. I loved everything she talked about and immediately ordered her book from Amazon. For the last month I have eaten mainly the foods she extolled (fruits, veggies, nuts, olive oil, fish, soy) and have made many of the recipes in the book. I have never felt better!In fact,I am planning on giving this book to all my training clients for Christmas. Even my husband and teenage kids love most of the recipes. Every recipe has been absolutely delicious and fairly simple to make. You may need to go to a special market that sells organic or ethnic food to buy some of the ingredients rather than find everything at the supermarket, but it's worth it. My only complaint is that she didn't include more recipes using cocoa powder. It has the highest antioxidant rating, yet she features it in only 3 recipes--none of them dessert! I hope Cheryl does a second book.  Atkins, shmatkins! This is the way to eat!	2004-06-21
US	17592844	R2SLYWFTD6MOUK	0873228545	965491494	Archery-2nd Edition: Steps to Success	Books	4	9	12	false	false	Not Impressed	I agree with another post that this book is primarily written for a summer camp counselor who is in charge of the archery course!  I was probably dissapointed because I read this after reading the revised edition of Dr. Kidwell's book Instinctive Archery Insights.  That book enlightened me, and helped my shooting, in ways I could never have imagined!  This book, Archery: Steps to Success is pretty basic.  If that is what you are looking for I guess it's OK.	2004-06-21
US	28679490	RYM6URKZSTGN0	0684800713	781452863	The Sun Also Rises	Books	5	3	3	false	false	brilliant	I read this book for required summer reading, and after a somewhat difficult-to-follow book, this novel was a breath of fresh air. It said this novel was famous because of Hemingway's prose, and I agree. He does not dress up this story with unfathomable metaphors and whatnot. He tells it like it is, which is what I like. This is the &quot;Lost Generation&quot; - the people right after World War I, and everyone's pretty much...lost. Our characters capture that theme very well, with their decadence (heavy drinking) and meandering. The characters Lady Brett Ashley and Jake Barnes are memorable. They both love each other very much, but Jake is impotent due to a war injury, and this prevents Brett from committing to him. This is a poignant novel, and sometimes, I could relate to their issues (minus the heavy drinking!) very well.	2004-06-21
US	17591925	R2XUMFD9F08FUB	0671025368	758176148	The Coldest Winter Ever	Books	4	1	4	false	false	great book horrible ending	i really liked da book but i hated da endin so much...if u like books dat just leave u like oo yea n dis and dat...dn u would love dis book...but if u dont den ull love da book but not the ending...and if u like love stories from da street den read dis...but over all its a great book	2004-06-21
US	48211412	R2RCFPRFSDIUSN	051788366X	325259394	How to Be Your Own Best Editor: The Toolkit for Everyone Who Writes	Books	3	12	12	false	false	Best argument against self editing	This book has a lot going for it: it is written in a lively and engaging manner; it offers helpful suggestions, such as points on how to make your writing more coherent and how to use transitions to glue paragraphs and sentences; and it is thorough, covering many points that readers will find useful.  However, this book is screaming for a final editor, someone besides its author.  It has enough typographical errors to be distracting. It sets a world record for the use of colons and dashes, marks that are useful only when used sparingly.  (After reading this book, my eyes were red after being zapped by so many of these usually underused marks.)  Finally, the author reveals that he has little ear for idioms.  For example, in his &quot;after&quot; passages used to illustate how passages can be corrected, he often uses the phrase &quot;Still and all.&quot;  I have never, ever read that phrase in print or heard it spoken.  At first I thought the phrase was another typo, but after I ran across it a few times I knew that it was not.  I can only assume that this book would have benefitted from a second set of eyes reviewing it before publication.	2004-06-21
US	26020956	RI3T0LXM9M41H	1583141030	115620801	Just Before Dawn (Arabesque)	Books	5	2	2	false	false	When All Else Is Said &amp; Done	&quot;Just Before Dawn&quot; is Sara Sterling's and Salem Lassiter's story. Sara's much deserved vacation back home on her parents' ranch turns out to be much more than she bargin for. Sara Sterling is a woman who has it together inside and outside of the courtroom. Salem Lassiter is a preimer vet. when they bring their dynamte lives toghether what can you expect accept for an expolsion.<br />So go ahead and turn off your phone and put the kids to sleep and get ready for a ride u will never forget.	2004-06-21
US	43232285	R2HMHHVV0UD1VT	0966772652	817817470	One on One: A Dog Trainer's Guide to Private Training	Books	5	5	5	false	false	A good dog trainer is also a good business consultant	This information-rich reference guide is beautifully organized, laced with humor and full of valuable tips, not just for the dog trainer who is new to private consulting, but for the more experienced trainer as well.  Good trainers are good business consultants. We can all benefit from being better, more professional business consultants.  Thank you, Nicole, for sharing the insights and practical tools to help us do that.	2004-06-21
US	49475284	R3CW66VOMUMCH4	0809044501	533753643	A Field Guide to the Little People	Books	5	10	11	false	false	&quot;Rationalists, materialists, be forewarned: ...	... the ancient, actual international forces governing earthly incident and momentum lie neither in our heads nor our economics but, rather, in the revelations from A Field Guide to the Little People.&quot; -The New York Times <BR>Yes, I think that quote does some justice to the spirit of this book. This book has been out of print for some time, but it is readily available and I highly recommend it for your children- if you want them to grow up twisted and warped and living in fear of the dark hours just before dawn when night elves dressed in fresh corpses and demons riding blind and deformed chickens roam the country side! I have a special attachment to this book, since it was given as gift to my mother when she was pregnant with me, and I grew up reading the short paragraph-length stories contained within it. <BR>There is a great deal of fodder for nightmares here and the art work in this book is especially haunting. Heinz Edelmann's drawings are far from simplistic, his imagery is dark and unsettling in an indescribable way. His gnarly, tortured lines are reminiscent of Alfred Kubin or Gunter Brus.  <BR>Also, consider this: the little people here are portrayed as imperfect and cruel and most of the little tales are about child murder, rape, decapitation, murder of pregnant women, greed, lust, senseless evil, and so on, written in a sober and almost detached manner. So, rationalists, materialists- and anyone who is particularly squeamish- be forewarned.	2004-06-21
US	17591712	RNC3JWLKX5OVX	1577341341	928691221	Symbols in Stone: Symbolism on the Early Temples of the Restoration	Books	5	8	9	false	false	You Will Know Them By Their Fruits	Excellent reading and excellent book for all Latter-day Saints who hold temple recomends. This has got to be the only Church that does not rely only on scriptures for salvation but through a living prophet! How could these prophets in the 1800's in the  last days make-up all these symbols when they are incorporated in the Old Testament. Sometimes you have to ask yourself, Where did they get the resources or internet for these men in the early 1800's? Answer: There was none. More than just reading the bible needed to take place, but through revelation. The accuracy of the book is flawless!	2004-06-21
US	17590968	RBIFAZ3N0J6LF	0930233549	873175483	The Symmetry Wave Trading Method	Books	5	7	7	false	false	Trading stocks and commodities	This book is an alternative to Elliott Wave theory. It is objective where as Elliott Wave theory is subjective. That is Elliott Wave changes its labeling of the price swings as the swings change. Whereas, Symmetry Wave being objective does not change its labeling of the price swings. It is a revolutionary idea that clusters correction of smaller sizes together to bring clarity to the price swings. Michael is the first person, publicly, to use Average True Range (ATR) for protective stop and profit target. I love using ATR as the stop method, because it uses the current volatility of the market to help me decide the profit target and the protective stop.	2004-06-21
US	48116223	R3CNBXNKM8G6IH	0520065255	774083887	Learning to Be A Sage: Selections from the Conversations of Master Chu, Arranged Topically	Books	4	12	23	false	false	An Excellent Guide on Moral Cultivation	In 'Learning to be a Sage' Chu Hsi observes that to be novel and artful are usually the goals of writers, when the real challenge is to be simple and understandable. Daniel Gardner's translation accomplishes the latter. The sayings of the Taoist sage are clear and compelling, assisted with metaphoric examples while not being burdened down by poetics.<br />The book is a meditation on the development of moral character. From beginning to end, Chu emphasizes the importance of education and study to the development of ethical principles. While he begins with a gloss on early education methods, he does not go where so many philosophers of education have: straight to a discussion of pedagogical method. Instead he merely says of teachers that they instruct a student in the beginning and correct him in the end, but that the responsibility of learning is on the student.<br />This responsibility underscores Chu's main recurrent theme in this text, the proper development of moral principle. While he writes much about the proper method of education, his most important discussion is of the proper motives for study. He laments (in complaints as relevent today as they were in the twelfth century) that people read only to impress others and to get ahead politically, not for the personal edification that learning brings.<br />The only drawback to this text is Gardner's commentary. The footnotes are helpful with tricky translations, but the embedded commentaries are distracting and border on arrogant. Rather than letting the reader decide the meaning of a text for himself (in the vein perhaps of a Buddhist koan), Gardner sometimes interjects that the meaning of a passage is unclear. Perhaps he ignored Chu Hsi advising to abandon preconceptions when reading. Normally one could well ignore distracting commenatry, but in this text it is not typographically distinct enough to be distinguished with ease.<br />This is a good text even for non-Taoists and those totally unfamiliar with the Way. It is a solid meditation on proper self-education and personal development for its own sake.	2004-06-21
US	31970121	RSFSW2P79NEOX	1929773005	603771684	Redefining Stuttering: What the struggle to speak is really about (Previously titled, How to Conquer Your Fears of Speaking before People)	Books	5	4	4	false	false	That's John For Your Knowledge &amp; Insight	John, <br />You are right on the mark with this book. The contents of this book, includes wisdom from a man who recovered from stuttering using exactly the tools listed within this book.<br />Thank you for sharing your life secrets...a true inspiration for me in my own recovery.	2004-06-21
US	38041223	R25Q6BJ7WLSHT3	0967578868	304925316	How to Spot Hidden Alcoholics: Using Behavioral Clues to Recognize Addiction in Its Early Stages	Books	5	2	5	false	false	Should be required reading!	This book is filled with pertinent, easily understood and astounding truths about the disease of alcoholism and its impact on all of our lives. The knowledge gained by reading this book willl allow the reader to quickly spot behavioral clues so as to avoid relationships with thlose people who are dependent on alcohol BEFORE their own lives are negatively affected. Too bad we can't teach this book in middle school classrooms. A GREAT READ!!!	2004-06-21
US	31888868	R4XQQQOJKN4M	0385508182	175800726	Dad Interrupted: A Novel	Books	5	5	5	false	false	A must read!!!!....Dwayne S. Joseph author of The Womanizers	Dad Interrupted was an excellent, excellent story about a man struggling to come to grips with the fact that, as we men tend to do, he screwed up and he's got a baby on the way. Van did a great job of delivering an important message while making you laugh out loud at the same time. His characters were funny, real, and believable. This is Van at his best. Dad Interrupted won't allow any interruptions because you won't want to put it down! Read this book. This is a book that deserves to be on the best-seller's lists!	2004-06-21
US	26653532	R3E6LED6GMW7XC	0851157157	509995770	The Sword in the Age of Chivalry	Books	3	13	18	false	false	The authority on sword classification	This book is an incredibly detailed academic work on the classification of swords from the 10th century through to the 15th century.<BR>The book is well written, and includes many clear photos (black and white) as well as dozens of sketchs to aid in the identification of these weapons.<BR>The book is full of various historical bits pertaining to each class of sword.<BR>However what makes this book so good, also makes it near useless to anyone but the die-hard sword collector.  The book never strays from its details of sword classifications and thier dates of usage.  I would not recommend reading this book &quot;for the fun of it&quot;.	2004-06-21
US	29523078	R1RZ7ZMU8L2ZZ9	0880324511	544587289	How to Pick up Guys	Books	2	0	1	false	false	Good for a gag!	This book was picked up as a lark.  It is good for a laugh.	2004-06-21
US	53073959	R3A0HQ8TLNGDKM	1865088129	991473943	Exploring Southeast Asia: A Traveller's History of the Region	Books	5	5	5	false	false	Excellent material to get a quick overview of the region!	We are planning a trip to south east Asia soon - I found this book in the local library, and after reading it, decided to purchase a copy for myself. The author is an expert on South East Asian affairs and does a great job summarizing the history of the region starting from some quick paragraphs of pre-history to BC, and then details of pre-colonial, colonial and post-colonial independence periods. Although a lot of the book deals with colonial influence in the region (hence not heavy on Thailand), it does a fair job of covering the different periods in history and a good summary w/maps at the end of the book.<br />Quick read and very informative! All SE countries are covered - Brunei, Burma, Cambodia, Laos, Singapore, Malaysia, East Timor, Indonesia, Thailand and Vietnam.	2004-06-21
US	45827024	R10F20YH9QB6IW	0451202503	251893357	The Songcatcher	Books	5	3	3	false	false	Haunting, lyrical	From the first page of this book Sharyn McCrumb gets her hooks into the reader and doesn't let you go.  <br />There are many reasons why I shouldn't have liked this book, and yet I did.  Normally I won't read a book that has more than two or three viewpoint characters.  This book had more than a dozen narrators, but such is McCrumb's talent that each character has a unique voice and point of view so you aren't jarred by the transitions.  <br />There is no mystery in here per se, though the book is shelved in the mystery section. And the action switches between past and present, tracing one family through the generations while events in the present unfold over the course of a few days.  <br />The real star of this book is the Appalachin setting, which McCrumb writes about lovingly but without sentimentality.  Every time I read one of her books I feel as if I had spent that time in her beloved mountains, meeting some of the wonderful and quirky characters who fill her stories.<br />A great read.  It's a treat to watch how McCrumb continues to grow as a writer in each of her books.	2004-06-21
US	51038699	R2M06TDDCN9V3K	019513074X	920319421	American Musical Theater: A Chronicle	Books	4	9	9	false	false	Paragraph description on EVERY show	I just finished reading all 821 pages of this book (no pictures), and am very proud of myself for having done so.<br />This reference book chronicles Musical Theatre in America, show-by-show, starting in 1757 (!) and reaching all the way to 2000.  Paragraphs are given for each show and can be found in chronological order of their opening nights.  Revivals are also discussed on their opening nights.<br />Despite the repetitive setup of the book's information, Bordman is able for the most part to write entertaining yet dense descriptions of the show's plot, hit songs, message, and overall run.  Although he spends more time on Musical Theatre's great hits (the biggest hits get a full page or two), some of Bordman's best writing moments come during his descriptions of some of Broadway's awful flops.<br />Other reviewers of this book criticize that Bordman has less to say about musicals since 1960.  I find this also to be true in some respects.  In Bordman's defense, this is in part due to the decline in Broadway's quality in the 1970s and 80s.  Bordman clearly comes from the camp of critics who feel that The Best Little Whorehouse in Texas and Cats, while popular, are not as artistically relevant as Oklahoma! and Show Boat.  Bordman is also no fanatic of Sondheim, as well, although he recognizes his lyric-writing genius.  For these reasons, the book gets four stars.<br />Having read the entire book, however, I must say that I know a lot more about American Musical Theatre than I did before, and probably know more by reading this book than by reading any other.  For libraries this book is a MUST have.  It's not cheap, but neither is any other 900-page hardcover book.  If you are looking for the ultimate reference on American Musical Theatre, this is it.	2004-06-21
US	22668931	R2OZDET431JDP0	0814471595	614155942	Celebration of Fools: An Inside Look at the Rise and Fall of JCPenney	Books	5	5	9	false	false	biased reviewers	Amazon:<BR>Please note that Mr. John is totally biased, as he admittedly knows several of the players in the book, ie very senior execs at JCPenney, which are blamed in the book for very nearly destroying the company.<br />Also, Mr. Lindsey is currently the senior corporate communications exec at JCPenney!  He should disclose this.  He was ordered to write that strange review -- his job probably depended on it.<br />You should delete both these reviews  -- they are totally biased, and unfair to your customers.	2004-06-21
US	17579619	R39ZZXPMBU9C0T	1885211317	301136412	The Penny Pincher's Passport to Luxury Travel (Travelers' Tales Guides)	Books	5	5	12	false	false	What a concept!	As a frequent flier junkie from way back, I find most of the tips to be good practical advice that doesn't make me cringe in embarrassment! What a concept!	2004-06-21
US	17583337	R2ZX0EUY1V8FN3	0325003262	648841980	The Energy to Teach	Books	4	3	7	false	false	energy	The book had many great ideas to help teachers meet the needs of their students while increasing their own energy level.  However, I think it went a little over board on the interviews.	2004-06-21
US	48666832	R1KKU6Y78WEDTV	188506134X	833825077	Birds of Kansas Field Guide	Books	5	21	21	false	false	Great resource	This is a terrific little book with the best photographs of birds I have seen in a field guide.  Organized by color of bird, so a novice can figure out where to start to ID what he is looking at.  Has basic info on each of the 115 most common Kansas birds.  If male and female are different colors, then they are listed seperatly, each with a small inset photograph and page number of the mate.	2004-06-21
US	43198294	R730IDN3L424G	1566913381	554529097	DEL-Moon Handbooks Ecuador: Including the Galapagos Islands	Books	5	5	7	false	false	Best of the 3 Ecuador books I bought	Hi, <br />I bought three Ecuador guides for my recent trip. Lonely Planet was pretty good but for detail on hotels and restaurants the Moon Guide gave the greatest detail	2004-06-21
US	52995728	RLVXLCRKFCFGC	0800753429	942576028	The Bondage of the Will	Books	5	10	11	false	false	Great Read	Luther wrote extensively about every possible issue facing the church, from theology proper to how to teach children to read so they can use the Bible.  But of all his works, this one was the book he hoped would be read by subsequent generations.  The message of the book really boils down to this - who saves whom.  For Luther, salvation was all about what God did to save sinners who can not even prepare themselves to receive saving grace.  In this work Luther is interacting with Erasmus, a Roman Catholic Humanist (in the good sense of that word) who also wanted reformation of the church.  However, while Luther's reformation focused on the gospel and how a sinner is saved, Erasmus' view was more about moral improvement and abuses in the church.  To the modern reader, Luther might sound harsh and mean spirited.  However, he was writing in a tone that was part of that day.  So don't get turned-off by the language and look to the argument.  There is much for us to learn today by this great master of the past!  Sola Fide!!	2004-06-21
