US	34711024	R1H0CDLQNIZ69N	1904433138	525000184	Cousins of Color	Books	5	0	0	false	false	An amazing journey	In the tradition of Stone and Vidal this vivid and visceral biographical novel took me on a page turning journey into the depths of David Fagan's soul.  William Schroder has painted a truly conflicted story of one man's agonizing and passionate clash between love of country and his personal truth.  Set in the Philippines during the Spanish American War, this country's frist encounter with \\"liberating occupation\\", I found myself engrossed in this remarkable story and asking the same difficult questions that must be facing many Americans in today challenging times.  When Hollywood makes this into a movie, and surly it will, I pray it will be as honest as this work so richly deserves.<BR>Excellent, absolutely excellent.	2004-06-21
US	31328971	RQWWL8OUJMX61	0974406619	196675144	Anonymity: A Tale of Suspense, Seduction & Revenge	Books	5	1	1	false	false	Solid mystery	This book is a must read for book lovers who love intrigue and fast paced action. This interwoven drama thriller kept me nervous for the main character, Cara. If you love romance, you will also find it here. I was captivated from the start by Cara's strength, intellect, and determination as she fought to clear her name and stay alive. I love to pick up a book and immediately become enthralled. Being and avid reader, I tried to stay ahead of the story, which is my test for a solid mystery, but found I was no match for Margie Shivers' imagination. I found myself suspicious of everybody, and that's what kept me turning pages. I was hooked. No wonder it's already an award winner.  Highly recommend this one and will purchase Margie Gosa Shivers book without even reading the storyline.	2004-06-21
US	50323648	R27EYQ7R82T7TQ	0575066814	504356428	Darkest Hour (The Age of Misrule)	Books	3	2	5	false	false	The battle continues	Chadbourn's second in the `Age of Misrule' is kind enough to open with a synposis of the previous novel, `World's End'. The story picks up promptly as our famous five learn that the essence of Balor is about to be given a physical host in the vast caverns under Edinburgh and only they can prevent it. With the vainglorious Tuatha de'Danaan ever present Church, Ruth, Veitch, Shavi and Laura (whose cynicism and self pity has becoming thoroughly grating) set off with their mentor Tom to stop the Fomorri from releasing their leader into the world.<BR>However, upon arrival in the Scottish capital we find a particularly nasty element of Celtic folklore made incarnate - the Calliach Bheur, pretty much undefeatable and bringer of winter to the land. As this hag moves through the city killing at will to protect the essence of Balor in time for the August 1 ritual, Shavi and Laura manage to defy the Bone Inspector and release the gloriously insane Maponus to do battle with her. Meanwhile, the now lupercini Callow kidnaps Ruth and she ends up in the clutches of Calatin who promptly forces the essence of Balor into her in the form of a Black Pearl. Now pregnant with the dark one, weeks remain until his rebirth, alien-style.<BR>What follows is a race north and south, Veitch and Tom to plead assistance from Tom's once-captor, the Queen of the Danaan, Ruth and Church head to Otherworld to Dian Cecht, Shavi attempts to join with the Bone Inspector to reimprison Maponus and in the interim Church has to deal with the emotional wrangling of Ruth, Laura and Niamh. Eventually, the second denouement occurs with a moment of great sacrifice, two characters die (though you suspect the Pendragon spirit will ensure a resurrection), Balor gets reborn and a host of assorted characters get removed and replaced with new ones.<BR>My only concern with this novel, is the author's continued use of drugs to achieve connection to the spiritual side of the new world. Its over-emphasis is disconcerting attimes and I wonder if it is truly necessary. This aside, whilst not as good as the opener, it serves up enough thrills and spills in an England turned back to magic to ensure the third and final novel is read.	2004-06-21
US	24805922	R2CMGEGAA6LF7Q	0836218833	508924803	Attack of the Deranged Mutant Killer Monster Snow Goons (Calvin & Hobbes)	Books	5	2	2	false	false	gas pedal for a foot locker kicks off	i used to think that &quot;the days are just packed&quot; was the best C&amp;H book but when i bought this one,i knew that it was the best.&quot;attack of the deranged muntant killer monster snow goons&quot; has some of the most funny comics i have ever read. this book contains:the attack of the snow goons,the 'calvin show',calvin's late school project,and the &quot;noodle incident&quot;.this is clearly the best. my favorite part in this book was the 'calvin show' where he cut some cardboard up and put his face in it and his dad said he'd prefer the tv with the volume control. yeah. that was hilarious.	2004-06-21
US	22313842	R3QDBLT44DT9FI	0060746734	799934454	The Connection: How al Qaeda's Collaboration with Saddam Hussein Has Endangered America	Books	4	25	39	false	false	Don't listen to the liberals - there is a link	Especially people like Dan who quotes that infamous and erroneous 9/11 commission report in which the media, democrat and liberal jumped on like flies on s**t to say the were &quot;no connections between Iraq and Al Queda.&quot; However, Kean and Hamilton said recently: &quot;Were there contacts between Al Qaeda and Iraq?&quot; Kean asked himself. &quot;Yes . . . no question.&quot; Hamilton joined in: &quot;The vice president is saying, I think, that there were connections . . . we don't disagree with that&quot; John F. Lehman, told NBC's &quot;Meet the Press&quot; that documents captured in Iraq &quot;indicate that there is at least one officer of Saddam's Fedayeen, a lieutenant colonel, who was a very prominent member of al Qaida.&quot; People, there are known connections between Iraq and Al Queda, even Clinton's admin acknowledged this (re: Sudan). This is an important book for curious people who dont trust the press and really want some information on this topic.  No they don't have connections with 9/11, but nobody in the Bush admin has purported it EVER.  Only the media has been making the connection with their numerous unscientific polls and with their warped and lazy reporting having the general public in the dark about the truth about the extent of Al Queda's tentacles. I think we are in for big surprises in the future when more revelations are found. Thanks, not to the mainstream media, but to investigative journalists like Mr. Hayes who actually wants to find the truth - not bend it. After reading this you wont have a doubt that Iraq and Al Queda are connected and posed a potential threat to the U.S. Dont let your political views blind you.  Fact is, a connection helps Bush immensley as far as justification for the Iraq. Why do you think liberals, democrats and mainstram media are so adverse to any connection?  The real answer most definitely isnt &quot;there arent any.&quot;  Also, if people want the answers about the Atta meeting in Prague, which was NEVER disproven, go to [...] !!	2004-06-21
US	40577123	R20EBJENHFCKTW	082941603X	503037651	Waiting with Gabriel: A Story of Cherishing a Baby's Brief Life	Books	3	18	31	false	false	An obsession with the worst possible outcomes	Because I am a mom to a child who has been through the three surgeries that Mrs Kuebelbeck describes, I knew that I needed to give myself time to read this book -- long after my knee-jerk reactions about things I'd heard from other heartmoms. So, finally, long after its release -- just last week, I read &quot;Waiting with Gabriel&quot;.<br />I wondered at times, if the universe Kuebelbeck described was really the same as the one I live in. Why, I wondered, would someone grasp at the worst possible outcomes when in fact, there are so very many good outcomes? Hmmm, 1999 is when Gabriel lived and died -- perhaps the Kuebelbeck's did not have access to the info that I did in 2001, when we received our in utero diagnosis of HRHS (initially dxed as HLHS). But even with that possible explanation, the fact is, I believe the Kuebelbeck's chose to find the negative at every turn based on what I read in the book. This was apparent not so much in the  info presented in the book, but in the kind of analysis and esp the attitude taken toward kids with hlhs.<br />Here are some examples:<br />Kuebelbeck offers a litany of the various medical/developmental problems that can come with hlhs, some of which include; the need for tube feedings (&quot;almost universal&quot;, she says), no contact sports allowed, poor circulation, and speech development issues.  The problem is that some of the issues Kuebelbeck lists are temporary -- or are not necessarily deep quality of life issues. For example, some kids with hlhs (and other heart problems, too) will need an ng tube -- but not forever. My child came home without an ng tube, and I know of many children with hlhs who never needed an ng tube beyond their first hospital stay. Contact sports? Well, maybe not - but not every child can play contact sports -- is that really enough to say their lives aren't worth living?<br />Kuebelbeck talks about visiting a family who had an infant with hlhs, and how the baby was blue and exhausted after crawling around the floor for a few minutes. Perhaps that baby had only had the Norwood and was ready for the next surgery, the Glenn -- see, it is this type of omission that concerns me -- since that baby may have &quot;looked&quot; much better after the next surgery. Kuebelbeck seems to have labeled that child as having a life not worth living. Again, unfair -- perhaps she should have visited a child post-fontan to make a more well-rounded assessment. <br />There were several instances when Kuebelbeck quoted drs and nurses as saying that if in her shoes, they would not pursue treatment. One nurse congratulated her for not putting Gabriel through the &quot;torture&quot; of the surgeries. Well, I have to wonder how that nurse, in good conscience continues to work in a unit where she feels children are being tortured. I can say that I sat with my daughter through recovery for three open heart surgeries - and while there were distinct moments of discomfort -- there was nothing that I could even remotely describe as torturous. I was there -- I saw it. I would hate for any parents considering surgery to believe that their child would experience &quot;unimaginable&quot; pain, as Kuebelbeck describes it.<br />In our surgical unit, there was a nurse there who had herself been through the fontan, and is devoted to the care of cardiac kids. I don't believe she feels that the children are going through torture. There is a 19 yr old young woman with HLHS who is currently studying at college so that she can enter med school to be a pediatric cardiac nurse. I don't believe she formulates her future as wanting to help torture young children by putting them through heart surgeries. <br />As a Catholic, I was disturbed by the license to do nothing, but I won't criticize the priest involved, since I can't know what information he had or didn't have. I can only say that I hope when he baptizes and confirms children and young folks in his parish who have hlhs and other heart defects that require the very same &quot;torturous&quot; surgeries, that he doesn't believe they have lives that are not worth living.<br />Clearly Gabriel had a lethal case of hlhs -- he did not even live long enough for the interventions that save so many other children. I cried through the rest of the book, particularly when Kuebelbeck describes the day of Gabriel's birth and the time of grief after his death. I so wish that Kuebelbeck would have focused more on these aspects -- those of cherishing Gabriel's life -- instead of trashing the lives of other children with hlhs. I did, however, appreciate her &quot;pro-life&quot; approach to carrying Gabriel.	2004-06-21
US	39615140	R3J49TIM3TLAUF	0972831010	299838265	Enemies Foreign and Domestic	Books	5	1	2	false	true	I hope I never have to witness this.	This is a story that could happen.  A goverment agency that is supposed to uphold the law conspires to frame people so they can become more powerful and to take away freedoms and rights.  They plant evidence, blow up people and say they are bomb makers.  They burn gun stores and say it's anti- gun activists and murder or kidnap people then frame them for crimes.  Who can stop them?  They are the ones who control evidence and do the investigations.  The answer to who can stop them is the common citizen.  This book says the people have power but you must also have courage and resourcefullnes.  This book is about how important our Constitution and Bill of Rights are and why we shouldn't mess with it or dilute it.  This book gives food for thought for those agree or disagree with the authors views.	2004-06-21
US	17584997	R3RWQTUEJIYK3V	096359673X	738408116	Haunted Wilmington and the Cape Fear Coast	Books	5	5	5	false	false	Cape Fear Paranormal	As a memeber of the Cape Fear Paranormal Investigations. I really enjoyed reading this book. If was full of history from the Wilmington area and has a lot of ghost stories that the CFPI had investigated. If you like ghost stories or history you will enjoy this book.	2004-06-21
US	24052376	R14G5UA1GVZGZ9	0609809806	48082452	SURVIVING THE DEATH OF A SIBLING:  Living Through Grief When an Adult Brother or Sister Dies	Books	5	5	5	false	false	This is a must read!	From the very first sentence, I was awestruck, mesmerized. I could not put this book down. TJ's heartfelt candor brought me on a journey of soulful insight and greater appreciation of what my daughters experienced in the loss of their older sister, Jackie; an event, forever blemishing their cherished sisterhood. Surviving the Death of a Sibling has helped to soothe their wounds, leading them on a path of healing and peace. It is a must read.	2004-06-21
US	17585738	RSCQBNZ0QDASJ	0767908171	997649583	A Short History of Nearly Everything	Books	5	13	15	false	false	A non-scientist's humble opinion	Some of the other reviews here seem a little too critical - &quot;for pre-school kids&quot; is plain irrational loftiness. It's true that the science here shines more with anecdotal warmth than academic rigour, but it does achieve what Bryson set out to do -- to give the general public some background in certain scienific fields, and more importantly perhaps, to capture their attention with colourful, engaging writing. In no way does it promise scientific depth; as another reviewer pointed out, this is easily seen from the title worded to attract a wider readership, therefore the critcisms of &quot;leave science to the scientists&quot; and &quot;too superficial to be informative&quot; are undeserved. It's like asserting that capitalism has failed because it doesn't promote equality. I think Bryson has introduced non-scientists to paleontology, earth sciences and astronomy in a wonderful way that comes rarely to scientists -- in this way he is a missionary, and the pedants are unhelpfully running on a different vision.	2004-06-21
US	37452805	R5LX3XL71FHI	1560526904	290749636	Creative Decision Making Using Positive Uncertainty: Second Edition (A Fifty-Minute Series)	Books	5	5	5	false	false	Decision Making Made Easier	As a career coach working in an internal career development center of a large corporation, I deal with a diverse cross section of the employee population.  A common thread, however, seems to be uncertainty about career goals, ranging from questions regarding skill development to more complex issues on structuring a radical career change.   Of the many resources I utilize, Creative Decision Making Using Positive Uncertainty stands out as one of the most helpful in clarifying issues and illuminating options.  Without exception, everyone who has used the creative processes in this book has praised its effectiveness in facilitating decision making and changing the fear of risk into the pursuit of opportunity.  It is a welcome and valuable addition to our career center library.	2004-06-21
US	52697458	R29JXOBRPDSJAR	0275948722	508770148	Moral Reasoning for Journalists: Cases and Commentary	Books	5	0	0	false	false	Useful Primer on Ethical Dilemmas in Journalism	This is an extremely well written collection of essays and case studies outlining the ethical issues behind journalism, which can be useful to both practicing journalists and media watchdogs. The book starts by dividing journalistic ethics into political, philosophical, and economic categories, in addition to issues of objectivity and privacy. This is followed by real-life case studies in which reporters and editors had to make tough ethical decisions regarding everything from crime to suicide, AIDS to car accidents, and political scandals to war reporting. The most refreshing aspect of this book is its insistence that none of these ethical crises have clear cut-and-dried answers, and that the process of examination and decision making in the face of such dilemmas is most important, while much can be learned from the experiences of the real-life journalists profiled here. This book impressively covers these very difficult questions. [~doomsdayer520~]	2004-06-21
US	17591712	RQJJ9R1FEWTX8	1560851678	359613299	Articles of Faith: (An exact photomechanical reproduction of the first edition)	Books	5	14	17	false	false	A Must Read for the LDS And the World	I thought Jesus the Christ by Talmage was excellent so I decided to read this. WOW what more can you say! I'm a convert to the Church for the last 2 1/2 years, I'm 28 years old and was sealed to my son and my wife who has been a member her whole life. I've have been with her for about 9 years and I finally got my act together and was sealed last year (2003) in Sept. I remember telling my wife &quot;you knew the church was true the whole time and never told me anything.&quot; Problem was I wasn't listening and shut my mind to greater things the Church has to offer. What a Blessing reading this book!	2004-06-21
US	32652605	R8OYCCYGRNKN1	0936756020	145085303	Simulations (Foreign Agents Series)	Books	5	6	10	false	false	Great book, bad edition.	A very interesting read on the nature of reality. Baudrillard has a wonderful way of shuffling your thinking that can only be understood by reading his work first hand. I highly recommend this work, but I would suggest buying a different edition; the Semiotext edition fell to pieces the first time I read it.	2004-06-21
US	17583245	R2BT5F36I2WEIC	0671741039	907356964	Swan Song	Books	1	7	47	false	false	You're right, it's ABSOLUTELY NOT &quot;The Stand&quot;	I have never been able to pick up a Robert R. McCammon book and finish it, with the notable exception of &quot;Blue World&quot;. Not only could I not finish this one, I had to WADE through the part I did read... and it was like wading through cold molasses. I couldn't put &quot;The Stand&quot; down. If you want to read some Mccammon, stick with his short stories. If you want a post-apocolyptic thriller, stick with &quot;The Stand&quot;... and then move on to the REST of Stephen King's Dark Tower saga... you'll find many more treasures than in this load of tripe.	2004-06-21
US	52906850	RZE6KM1DOHGQX	0060096861	221324216	American Taboo: A Murder in the Peace Corps	Books	1	17	40	false	false	Dreadful hack job of writing.	Poor writing &amp; a pointless, meandering narration that's overly focused on the author himself, make this a book to AVOID.	2004-06-21
US	50810207	RBB5CWUVYTU1O	0380792028	726577953	Glorious Angel (Southern Series)	Books	2	6	6	false	false	No plot, shallow characters	I've been rereading all the JLs (so far, I've finished 18 in a month), and &quot;Glorious Angel&quot; is just as I remembered it 10 years ago: unappealing, passionless, and actually quite tedious. It is one of JL's first books, and it is obviously a pedestrian effort. The &quot;love&quot; dialogue is beyond cheesy and the love scenes are tepid. Worse, it has a meandering plot that starts with Angela's crush on Bradford as a child (why she likes him, I'll never know), then moves on to a rags-to-riches story with Angela losing all of her Southern white trash talk (which was actually quite charming), to a forced separation based on a rumor of incest that really never seemed to upset Angela other than to make her run away from Bradford. The best part about this book is that it sets up Hank Chavez's story in &quot;Heart of Thunder,&quot; which is a million times better. In fact, only a single year separates the publication of &quot;Glorious Angel&quot; and &quot;Heart of Thunder,&quot; but somehow JL's writing style, sense of character, and dialogue improve tremendously during that short time period. Which makes me suspect that &quot;Glorious Angel&quot; was written long, long before its publication date and published without the benefit of editing, rewriting, etc. That's too bad. &quot;Glorious Angel&quot; could have been much better had JL spent some more time playing up the passion and personalities between Angela and Bradford and less time on fluff like matchmaking in Texas and the pointless assassination attempts on Bradford's life (as an example of how silly this book is, Bradford is tied to a chair in a burning house and his fear of death gives him He-Man strength to break through the ropes, no knife or anything, to escape. Wow!). If you are interested in Wild West romances written by JL, I highly recommend &quot;Heart of Thunder,&quot; &quot;A Heart So Wild,&quot; &quot;Once A Princess,&quot; or &quot;Savage Thunder.&quot; I do not recommend &quot;Glorious Angel&quot; unless you want to read it as a prequel to &quot;Heart of Thunder.&quot;	2004-06-21
US	17582835	R3M90N0PA0X000	0553281437	46791929	The Prophet of Akhran (Rose of the Prophet, Book 3)	Books	5	1	3	false	false	More than 5 stars... I'd give it a 100 stars	This is the best series of Margaret Weiss.  The characters sizzles.  I love PUKAH.  This series has adventure ,romance, funny moments all wrapped into one.  Done very very simultaneously.  Unlike other fantasy books, Margaret Weiss style is light , touching, deep n most of all easy to understand n easy to realte to.  It will carry you to another world.	2004-06-21
US	31121254	R3UXIP2F65DB1X	0679735771	92932803	American Psycho	Books	5	4	5	false	false	Obviously, conservatives will dislike this book - but so?	American Psycho is highly controversial, and there is no point in avoiding this issue.  However, a book is not to be judged as &quot;excrement&quot; or &quot;inferior&quot; on the basis of the controversy it happens to generate; if this were the case, the Bible, Hobbes' Leviathan, and Plato's Republic could all be considered &quot;excrement&quot; by any number of people.  And yet, any reasoned approach will see the merit (as well as the flaws) of any given piece of literature.<br />I have given American Psycho a five-star rating because it is not controversial for the sake of being controversial.  The novel must be examined in the context of Ellis' other novels, which examine the correlation between amorality and material privilege and what sort of effects this phenomenon has in American society.  In many ways Less Than Zero, Ellis' first novel, is more disturbing than American Psycho, despite the lack of gruesome serial murders and such, yet many of the same critics who look upon American Psycho with derision will find much value in Less Than Zero.  Why is this?  Some have argued that Less Than Zero attempts to demonstrate what might have gone wrong with America's &quot;children&quot;, whereas American Psycho has no project, has no aim, save to disgust and to shock its audience.<br />This assessment is faulty.  The character of Patrick Bateman is not some isolated psychotic created from a void; he is a product of the society in which he lives, our consumerist liberal society, and he is the extreme personification of all of our society's negative traits.  His contempt and disgust for much of the world is not something totally unfamiliar to us &quot;regular&quot; people, as we have felt it from time to time, except perhaps we do not wish to admit it.  The fact that there is a Patrick Bateman &quot;out there&quot; makes us feel more comfortable about the &quot;us, in here&quot;; if HE is bad, then we, in relation to him, are not so bad.  Of course, the dialectic reveals our complicity in Patrick's personality, and we are not so innocent in the final assessment after all.  <br />American Psycho is a powerful and important novel.	2004-06-21
US	53037408	R3ET1ESFCG8O0O	047139470X	357825263	Testing Applications on the Web: Test Planning for Internet-Based Systems	Books	5	7	7	false	false	Superseded by a better second edition	When industry leaders such as Cem Kaner and Bret Pettichord extol the virtues of this book you can be assured that it is great - everything they and other reviewers have said is on target.  Moreover, you'd be hard-pressed to walk into the testing area in any company and not see a copy of this book on someone's desk.<br />That said, instead of this book you should get the second edition, which is a major rewrite, and also expanded in scope to include testing mobile systems.  This edition is titled, &quot;Testing Applications on the Web: Test Planning for Mobile and Internet-Based Systems&quot; ISBN 0471201006, and is everything others have said about this first edition - and more!<br />Even with a better second edition, this book deserves the five stars I gave it because of the influence it has had on the testing profession.  Moreoever, this first edition is not out-of-date, and is still a great book if you don't need information about testing mobile web systems at this time (although it's a safe bet you will in the future).	2004-06-21
